{
  "schema_version": "greenfin-retrieval-result/1.0.0",
  "index_snapshot_id": "vector-index:0123456789abcdef01234567",
  "query_hash": "bbbbbbbbbbbbbbbbbbbbbbbbbbbbbbbbbbbbbbbbbbbbbbbbbbbbbbbbbbbbbbbb",
  "filter": {
    "document_id": [
      "paper:green-bond-2026"
    ],
    "source_type": [
      "paper_fulltext"
    ],
    "access_level": [
      "open"
    ]
  },
  "results": [
    {
      "chunk_id": "chk_0123456789abcdef0123",
      "document_id": "paper:green-bond-2026",
      "evidence_id": "evd_0123456789abcdef0123",
      "score": 0.812345678901,
      "rank": 1,
      "locator": {
        "section": "Results",
        "page": 12,
        "start_char": 240,
        "end_char": 466
      },
      "release_id": "release:2026-08-09",
      "asset_id": "asset:paper:green-bond-2026:pdf",
      "document_version": "v1",
      "content_hash": "cccccccccccccccccccccccccccccccccccccccccccccccccccccccccccccccc",
      "content_sha256": "aaaaaaaaaaaaaaaaaaaaaaaaaaaaaaaaaaaaaaaaaaaaaaaaaaaaaaaaaaaaaaaa",
      "text_sha256": "cccccccccccccccccccccccccccccccccccccccccccccccccccccccccccccccc",
      "access_level": "open",
      "license": "CC-BY-4.0",
      "source_type": "paper_fulltext"
    }
  ]
}
